{
  "object_type": "ai_request",
  "schema_version": "1.0.0",
  "ai_request_id": "01HZXY9J72Q3E1C1H8Y3D6W2KP",
  "requester_id": "agent-forecasting",
  "model": "gpt-4.1-mini",
  "prompt": "Summarize the latest workflow anomalies.",
  "parameters": {
    "temperature": 0.2,
    "max_tokens": 320
  },
  "requested_at": "2025-01-15T12:18:00Z",
  "input_refs": ["workflow-run:01HZXY8Q5GZ07W83T46R6N0P3M"],
  "trace": {
    "trace_id": "trace-92384",
    "span_id": "span-12934"
  },
  "created_at": "2025-01-15T12:18:00Z",
  "updated_at": "2025-01-15T12:18:00Z",
  "metadata": { "priority": "standard" }
}
